202311,도새기1982중문점,20230706,가정식,제주 서귀포시 중문동 1627번지 1층,상위 75~90%,상위 25~50%,상위 25~50%,0.24,0.18,0.15,0.09,0.03,0.18,0.12,0.0,0.0,0.0,0.94,0.06,0.74,0.64,0.36,0.14,0.2,0.32,0.27,0.08,0.7,0.3,"202311 기준 '도새기1982중문점'(주소: 제주 서귀포시 중문동 1627번지 1층)은/는 20230706에 개설된 가정식 업종입니다. 이용 시간대별 비중은 5~11시 0.0%, 12~13시 0.0%, 14~17시 0.0%, 18~22시 0.94%, 23~4시 0.06%입니다. 요일별 이용 비중은 월요일 0.24, 화요일 0.18, 수요일 0.15, 목요일 0.09, 금요일 0.03, 토요일 0.18, 일요일 0.12입니다. 평일 0.3, 주말0.7현지인 이용 비중은 0.74입니다. 최근 12개월간 남성 회원 비중은 0.64, 여성 회원 비중은 0.36 입니다. 연령대별 회원 비중은 20대 이하 0.14, 30대 0.2, 40대 0.32, 50대 0.27, 60대 이상 0.08입니다. 이 가맹점의 이용 건수 구간은 5_75~90%이며, 이용 금액 구간은 3_25~50%입니다. 건당 평균 이용 금액 구간은 3_25~50%입니다. 해당 가맹점의 고객 평균 재방문율은 1.32 입니다. 해당 가맹점에 대한 이용객의 리뷰 키워드는 다음과 같습니다: [숙성대패, 고추장대패, 맛있다, 친절하다, 가성비, 깔끔하다, 돼지껍데기, 초밥, 맛집, 추천, 룸, 회식, 서비스, 웨이팅, 넓다, 매장, 좋다, 냉삼, 삼겹살,  번창] 
",33.2555695,126.4262202,1.32,"[숙성대패, 고추장대패, 맛있다, 친절하다, 가성비, 깔끔하다, 돼지껍데기, 초밥, 맛집, 추천, 룸, 회식, 서비스, 웨이팅, 넓다, 매장, 좋다, 냉삼, 삼겹살,  번창] 
"
202311,대게마을,20160817,단품요리 전문,제주 제주시 도두이동 706-9번지 제주시서해안로 350동 1호,상위 75~90%,상위 10% 이하,상위 10% 이하,0.2,0.13,0.13,0.07,0.17,0.17,0.13,0.0,0.07,0.2,0.73,0.0,0.36,0.58,0.42,0.08,0.25,0.34,0.25,0.08,0.7,0.3,"202311 기준 '대게마을'(주소: 제주 제주시 도두이동 706-9번지 제주시서해안로 350동 1호)은/는 20160817에 개설된 단품요리 전문 업종입니다. 이용 시간대별 비중은 5~11시 0.0%, 12~13시 0.07%, 14~17시 0.2%, 18~22시 0.73%, 23~4시 0.0%입니다. 요일별 이용 비중은 월요일 0.2, 화요일 0.13, 수요일 0.13, 목요일 0.07, 금요일 0.17, 토요일 0.17, 일요일 0.13입니다. 평일 0.3, 주말0.7현지인 이용 비중은 0.36입니다. 최근 12개월간 남성 회원 비중은 0.58, 여성 회원 비중은 0.42 입니다. 연령대별 회원 비중은 20대 이하 0.08, 30대 0.25, 40대 0.34, 50대 0.25, 60대 이상 0.08입니다. 이 가맹점의 이용 건수 구간은 5_75~90%이며, 이용 금액 구간은 1_상위 10% 이하입니다. 건당 평균 이용 금액 구간은 1_상위 10% 이하입니다. 해당 가맹점의 고객 평균 재방문율은 1.0 입니다. 해당 가맹점에 대한 이용객의 리뷰 키워드는 다음과 같습니다: [신선, 맛있, 싱싱, 꽉차, 율, 친절, 깔끔, 부드럽, 행복, 만족, 좋, 뷰, 푸짐, 배부르, 넉넉, 엄청, 최고, 다양, 가성비, 훌륭] 
",33.510291,126.482585,1.0,"[신선, 맛있, 싱싱, 꽉차, 율, 친절, 깔끔, 부드럽, 행복, 만족, 좋, 뷰, 푸짐, 배부르, 넉넉, 엄청, 최고, 다양, 가성비, 훌륭] 
"
202311,돈삼겹노형점,20230802,단품요리 전문,제주 제주시 연동 265-3번지 1층,상위 50~75%,상위 25~50%,상위 25~50%,0.13,0.15,0.17,0.12,0.08,0.23,0.12,0.0,0.04,0.08,0.75,0.13,0.82,0.55,0.45,0.16,0.27,0.32,0.19,0.06,0.65,0.35,"202311 기준 '돈삼겹노형점'(주소: 제주 제주시 연동 265-3번지 1층)은/는 20230802에 개설된 단품요리 전문 업종입니다. 이용 시간대별 비중은 5~11시 0.0%, 12~13시 0.04%, 14~17시 0.08%, 18~22시 0.75%, 23~4시 0.13%입니다. 요일별 이용 비중은 월요일 0.13, 화요일 0.15, 수요일 0.17, 목요일 0.12, 금요일 0.08, 토요일 0.23, 일요일 0.12입니다. 평일 0.35, 주말0.65현지인 이용 비중은 0.82입니다. 최근 12개월간 남성 회원 비중은 0.55, 여성 회원 비중은 0.45 입니다. 연령대별 회원 비중은 20대 이하 0.16, 30대 0.27, 40대 0.32, 50대 0.19, 60대 이상 0.06입니다. 이 가맹점의 이용 건수 구간은 4_50~75%이며, 이용 금액 구간은 3_25~50%입니다. 건당 평균 이용 금액 구간은 3_25~50%입니다. 해당 가맹점의 고객 평균 재방문율은 2.08 입니다. 해당 가맹점에 대한 이용객의 리뷰 키워드는 다음과 같습니다: [맛있다, 최고, 가성비, 친절, 푸짐, 깨끗, 넓다, 신선, 셀프, 볶음밥, 든든, 배부르다, 만족, 칭찬, 재방문, 단골, 추천, 맛집, 서비스, 저렴] 
",33.4835129,126.4889443,2.08,"[맛있다, 최고, 가성비, 친절, 푸짐, 깨끗, 넓다, 신선, 셀프, 볶음밥, 든든, 배부르다, 만족, 칭찬, 재방문, 단골, 추천, 맛집, 서비스, 저렴] 
"
202311,제주늘봄,19930113,가정식,제주 제주시 노형동 2301번지,상위 10% 이하,상위 10% 이하,상위 10% 이하,0.11,0.14,0.2,0.11,0.13,0.15,0.16,0.04,0.36,0.16,0.45,0.0,0.61,0.54,0.46,0.05,0.1,0.23,0.28,0.34,0.69,0.31,"202311 기준 '제주늘봄'(주소: 제주 제주시 노형동 2301번지)은/는 19930113에 개설된 가정식 업종입니다. 이용 시간대별 비중은 5~11시 0.04%, 12~13시 0.36%, 14~17시 0.16%, 18~22시 0.45%, 23~4시 0.0%입니다. 요일별 이용 비중은 월요일 0.11, 화요일 0.14, 수요일 0.2, 목요일 0.11, 금요일 0.13, 토요일 0.15, 일요일 0.16입니다. 평일 0.31, 주말0.69현지인 이용 비중은 0.61입니다. 최근 12개월간 남성 회원 비중은 0.54, 여성 회원 비중은 0.46 입니다. 연령대별 회원 비중은 20대 이하 0.05, 30대 0.1, 40대 0.23, 50대 0.28, 60대 이상 0.34입니다. 이 가맹점의 이용 건수 구간은 1_상위 10% 이하이며, 이용 금액 구간은 1_상위 10% 이하입니다. 건당 평균 이용 금액 구간은 1_상위 10% 이하입니다. 해당 가맹점의 고객 평균 재방문율은 2.38 입니다. 해당 가맹점에 대한 이용객의 리뷰 키워드는 다음과 같습니다: [흑돼지, 양념갈비, 불고기, 전골, 맛있다, 푸짐하다, 가성비, 친절하다, 넓다, 깔끔하다, 룸, 쾌적하다,  든든하다,  만족,  신선하다,  세심,  서비스,  주차,  단골,  추천] 
",33.4796615,126.4719343,2.38,"[흑돼지, 양념갈비, 불고기, 전골, 맛있다, 푸짐하다, 가성비, 친절하다, 넓다, 깔끔하다, 룸, 쾌적하다,  든든하다,  만족,  신선하다,  세심,  서비스,  주차,  단골,  추천] 
"
202311,완미족발제주연동점,20220701,단품요리 전문,제주 제주시 연동 273-58번지 2층,상위 50~75%,상위 50~75%,상위 25~50%,0.06,0.23,0.14,0.14,0.11,0.14,0.17,0.0,0.0,0.03,0.91,0.06,0.58,0.67,0.33,0.26,0.29,0.26,0.14,0.06,0.69,0.31,"202311 기준 '완미족발제주연동점'(주소: 제주 제주시 연동 273-58번지 2층)은/는 20220701에 개설된 단품요리 전문 업종입니다. 이용 시간대별 비중은 5~11시 0.0%, 12~13시 0.0%, 14~17시 0.03%, 18~22시 0.91%, 23~4시 0.06%입니다. 요일별 이용 비중은 월요일 0.06, 화요일 0.23, 수요일 0.14, 목요일 0.14, 금요일 0.11, 토요일 0.14, 일요일 0.17입니다. 평일 0.31, 주말0.69현지인 이용 비중은 0.58입니다. 최근 12개월간 남성 회원 비중은 0.67, 여성 회원 비중은 0.33 입니다. 연령대별 회원 비중은 20대 이하 0.26, 30대 0.29, 40대 0.26, 50대 0.14, 60대 이상 0.06입니다. 이 가맹점의 이용 건수 구간은 4_50~75%이며, 이용 금액 구간은 4_50~75%입니다. 건당 평균 이용 금액 구간은 3_25~50%입니다. 해당 가맹점의 고객 평균 재방문율은 1.04 입니다. 해당 가맹점에 대한 이용객의 리뷰 키워드는 다음과 같습니다: [맛있다, 푸짐하다, 깔끔하다, 친절하다, 족발, 밑반찬, 주먹밥, 양, 맛집, 만족, 추천, 쫄깃, 부드럽다, 냄새, 촉촉하다, 시원하다, 넓다, 쾌적하다, 가성비, 든든하다] 
",33.4865745,126.4908379,1.04,"[맛있다, 푸짐하다, 깔끔하다, 친절하다, 족발, 밑반찬, 주먹밥, 양, 맛집, 만족, 추천, 쫄깃, 부드럽다, 냄새, 촉촉하다, 시원하다, 넓다, 쾌적하다, 가성비, 든든하다] 
"
202311,주민상회 노형점,20230102,가정식,제주 제주시 노형동 1278-3번지 1층,상위 75~90%,상위 50~75%,상위 25~50%,0.03,0.12,0.0,0.03,0.28,0.25,0.28,0.0,0.0,0.0,0.56,0.44,0.86,0.71,0.29,0.27,0.29,0.28,0.15,0.02,0.47,0.53,"202311 기준 '주민상회 노형점'(주소: 제주 제주시 노형동 1278-3번지 1층)은/는 20230102에 개설된 가정식 업종입니다. 이용 시간대별 비중은 5~11시 0.0%, 12~13시 0.0%, 14~17시 0.0%, 18~22시 0.56%, 23~4시 0.44%입니다. 요일별 이용 비중은 월요일 0.03, 화요일 0.12, 수요일 0.0, 목요일 0.03, 금요일 0.28, 토요일 0.25, 일요일 0.28입니다. 평일 0.53, 주말0.47현지인 이용 비중은 0.86입니다. 최근 12개월간 남성 회원 비중은 0.71, 여성 회원 비중은 0.29 입니다. 연령대별 회원 비중은 20대 이하 0.27, 30대 0.29, 40대 0.28, 50대 0.15, 60대 이상 0.02입니다. 이 가맹점의 이용 건수 구간은 5_75~90%이며, 이용 금액 구간은 4_50~75%입니다. 건당 평균 이용 금액 구간은 3_25~50%입니다. 해당 가맹점의 고객 평균 재방문율은 1.1 입니다. 해당 가맹점에 대한 이용객의 리뷰 키워드는 다음과 같습니다: [가성비, 맛있다, 친절하다, 좋다, 굿, 최고, 맛집, 분위기, 시원하다, 넘다, 다양하다, 넉넉하다, 깨끗하다, 저렴하다, 맥주, 술, 안주, 샤베트, 떡볶이, 치킨] ",33.4881247,126.478756,1.1,"[가성비, 맛있다, 친절하다, 좋다, 굿, 최고, 맛집, 분위기, 시원하다, 넘다, 다양하다, 넉넉하다, 깨끗하다, 저렴하다, 맥주, 술, 안주, 샤베트, 떡볶이, 치킨] "
202311,도진식당,20160818,가정식,제주 제주시 연동 1507-11번지,상위 75~90%,상위 75~90%,상위 25~50%,0.1,0.41,0.14,0.03,0.14,0.07,0.1,0.07,0.38,0.14,0.41,0.0,0.56,0.49,0.51,0.04,0.14,0.23,0.39,0.2,0.83,0.17,"202311 기준 '도진식당'(주소: 제주 제주시 연동 1507-11번지)은/는 20160818에 개설된 가정식 업종입니다. 이용 시간대별 비중은 5~11시 0.07%, 12~13시 0.38%, 14~17시 0.14%, 18~22시 0.41%, 23~4시 0.0%입니다. 요일별 이용 비중은 월요일 0.1, 화요일 0.41, 수요일 0.14, 목요일 0.03, 금요일 0.14, 토요일 0.07, 일요일 0.1입니다. 평일 0.17, 주말0.83현지인 이용 비중은 0.56입니다. 최근 12개월간 남성 회원 비중은 0.49, 여성 회원 비중은 0.51 입니다. 연령대별 회원 비중은 20대 이하 0.04, 30대 0.14, 40대 0.23, 50대 0.39, 60대 이상 0.2입니다. 이 가맹점의 이용 건수 구간은 5_75~90%이며, 이용 금액 구간은 5_75~90%입니다. 건당 평균 이용 금액 구간은 3_25~50%입니다. 해당 가맹점의 고객 평균 재방문율은 1.1 입니다. 해당 가맹점에 대한 이용객의 리뷰 키워드는 다음과 같습니다: [돌솥밥, 맛있다, 반찬, 한식, 돼지불고기, 정식, 불고기, 채소, 제육, 특별하다, 무난, 건강하다, 추천, 굿굿굿, 밑반찬, 맛집, 재방문, 싹싹, 신랑, 회사, 직원, 저녁, 바쁘다, 친절하다, 예약, 깨끗하다, 가격, 양, 아쉽다, 감사하다, 두번째, 여행, 전복, 진식, 딩, 제주, 컬, 갈치구이, 솥밥, 다양, 힌, 마지막, 점심, 푸다] 
",33.4790639,126.492281,1.1,"[돌솥밥, 맛있다, 반찬, 한식, 돼지불고기, 정식, 불고기, 채소, 제육, 특별하다, 무난, 건강하다, 추천, 굿굿굿, 밑반찬, 맛집, 재방문, 싹싹, 신랑, 회사, 직원, 저녁, 바쁘다, 친절하다, 예약, 깨끗하다, 가격, 양, 아쉽다, 감사하다, 두번째, 여행, 전복, 진식, 딩, 제주, 컬, 갈치구이, 솥밥, 다양, 힌, 마지막, 점심, 푸다] 
"
202311,성산일출봉 어멍횟집,20130220,단품요리 전문,제주 서귀포시 성산읍 고성리 325-12번지,상위 25~50%,상위 10% 이하,상위 10% 이하,0.04,0.11,0.21,0.26,0.13,0.16,0.09,0.0,0.03,0.09,0.88,0.0,0.04,0.56,0.44,0.22,0.26,0.23,0.22,0.07,0.75,0.25,"202311 기준 '성산일출봉 어멍횟집'(주소: 제주 서귀포시 성산읍 고성리 325-12번지)은/는 20130220에 개설된 단품요리 전문 업종입니다. 이용 시간대별 비중은 5~11시 0.0%, 12~13시 0.03%, 14~17시 0.09%, 18~22시 0.88%, 23~4시 0.0%입니다. 요일별 이용 비중은 월요일 0.04, 화요일 0.11, 수요일 0.21, 목요일 0.26, 금요일 0.13, 토요일 0.16, 일요일 0.09입니다. 평일 0.25, 주말0.75현지인 이용 비중은 0.04입니다. 최근 12개월간 남성 회원 비중은 0.56, 여성 회원 비중은 0.44 입니다. 연령대별 회원 비중은 20대 이하 0.22, 30대 0.26, 40대 0.23, 50대 0.22, 60대 이상 0.07입니다. 이 가맹점의 이용 건수 구간은 3_25~50%이며, 이용 금액 구간은 1_상위 10% 이하입니다. 건당 평균 이용 금액 구간은 1_상위 10% 이하입니다. 해당 가맹점의 고객 평균 재방문율은 1.02 입니다. 해당 가맹점에 대한 이용객의 리뷰 키워드는 다음과 같습니다:  어멍 횟집 키워드:고등어회, 갈치회, 신선, 맛있다, 푸짐, 배부르다, 친절, 깔끔, 넓다, 쾌적, 룸, 주차장, 밑반찬, 탕, 튀김, 막걸리, 맥주, 한라산, 세트, 가성비 ",33.4481096,126.9157212,1.02," 어멍 횟집 키워드:고등어회, 갈치회, 신선, 맛있다, 푸짐, 배부르다, 친절, 깔끔, 넓다, 쾌적, 룸, 주차장, 밑반찬, 탕, 튀김, 막걸리, 맥주, 한라산, 세트, 가성비 "
202311,에그드랍 제주공항점,20220714,단품요리 전문,제주 제주시 용담이동 2002번지 1층,상위 10% 이하,상위 10% 이하,상위 90% 초과(하위 10% 이하),0.12,0.15,0.18,0.15,0.16,0.12,0.13,0.42,0.17,0.27,0.14,0.0,0.2,0.48,0.52,0.24,0.27,0.25,0.18,0.06,0.75,0.25,"202311 기준 '에그드랍 제주공항점'(주소: 제주 제주시 용담이동 2002번지 1층)은/는 20220714에 개설된 단품요리 전문 업종입니다. 이용 시간대별 비중은 5~11시 0.42%, 12~13시 0.17%, 14~17시 0.27%, 18~22시 0.14%, 23~4시 0.0%입니다. 요일별 이용 비중은 월요일 0.12, 화요일 0.15, 수요일 0.18, 목요일 0.15, 금요일 0.16, 토요일 0.12, 일요일 0.13입니다. 평일 0.25, 주말0.75현지인 이용 비중은 0.2입니다. 최근 12개월간 남성 회원 비중은 0.48, 여성 회원 비중은 0.52 입니다. 연령대별 회원 비중은 20대 이하 0.24, 30대 0.27, 40대 0.25, 50대 0.18, 60대 이상 0.06입니다. 이 가맹점의 이용 건수 구간은 1_상위 10% 이하이며, 이용 금액 구간은 1_상위 10% 이하입니다. 건당 평균 이용 금액 구간은 6_90% 초과(하위 10% 이하)입니다. 해당 가맹점의 고객 평균 재방문율은 1.36 입니다. 해당 가맹점에 대한 이용객의 리뷰 키워드는 다음과 같습니다: [넓다, 부드럽다, 맛있다, 싱겁다, 편하다, 좋다, 조용하다, 빠르다, 홀가분하다, 넉넉하다, 맛있다, 굿, 든든하다, 행복하다, 간단하다, 듬뿍, 맛있다, 쾌적하다, 신선하다, 최고] ",33.507781,126.4931329,1.36,"[넓다, 부드럽다, 맛있다, 싱겁다, 편하다, 좋다, 조용하다, 빠르다, 홀가분하다, 넉넉하다, 맛있다, 굿, 든든하다, 행복하다, 간단하다, 듬뿍, 맛있다, 쾌적하다, 신선하다, 최고] "
202311,시카고피자남원점,20180502,피자,제주 서귀포시 남원읍 남원리 117-2번지 0호,상위 50~75%,상위 90% 초과(하위 10% 이하),상위 50~75%,0.21,0.05,0.03,0.18,0.28,0.15,0.1,0.0,0.0,0.44,0.56,0.0,0.6,0.59,0.41,0.09,0.18,0.38,0.23,0.11,0.74,0.26,"202311 기준 '시카고피자남원점'(주소: 제주 서귀포시 남원읍 남원리 117-2번지 0호)은/는 20180502에 개설된 피자 업종입니다. 이용 시간대별 비중은 5~11시 0.0%, 12~13시 0.0%, 14~17시 0.44%, 18~22시 0.56%, 23~4시 0.0%입니다. 요일별 이용 비중은 월요일 0.21, 화요일 0.05, 수요일 0.03, 목요일 0.18, 금요일 0.28, 토요일 0.15, 일요일 0.1입니다. 평일 0.26, 주말0.74현지인 이용 비중은 0.6입니다. 최근 12개월간 남성 회원 비중은 0.59, 여성 회원 비중은 0.41 입니다. 연령대별 회원 비중은 20대 이하 0.09, 30대 0.18, 40대 0.38, 50대 0.23, 60대 이상 0.11입니다. 이 가맹점의 이용 건수 구간은 4_50~75%이며, 이용 금액 구간은 6_90% 초과(하위 10% 이하)입니다. 건당 평균 이용 금액 구간은 4_50~75%입니다. 해당 가맹점의 고객 평균 재방문율은 1.14 입니다. 해당 가맹점에 대한 이용객의 리뷰 키워드는 다음과 같습니다: [맛있다, 듬뿍, 최고, 깨끗하다, 친절하다, 굿, 맛집, 가성비, 빵, 치즈, 시카고, 특별하다, 후회, 진짜, 넘다, 정말, 자다, 괜찮다, 좋다, 꿀맛] 
",33.2787365,126.7169706,1.14,"[맛있다, 듬뿍, 최고, 깨끗하다, 친절하다, 굿, 맛집, 가성비, 빵, 치즈, 시카고, 특별하다, 후회, 진짜, 넘다, 정말, 자다, 괜찮다, 좋다, 꿀맛] 
"
202311,산우정,20100212,가정식,제주 제주시 연동 283-21번지,상위 25~50%,상위 10% 이하,상위 10~25%,0.0,0.11,0.19,0.21,0.19,0.21,0.1,0.0,0.0,0.16,0.84,0.0,0.56,0.57,0.43,0.31,0.4,0.2,0.07,0.02,0.7,0.3,"202311 기준 '산우정'(주소: 제주 제주시 연동 283-21번지)은/는 20100212에 개설된 가정식 업종입니다. 이용 시간대별 비중은 5~11시 0.0%, 12~13시 0.0%, 14~17시 0.16%, 18~22시 0.84%, 23~4시 0.0%입니다. 요일별 이용 비중은 월요일 0.0, 화요일 0.11, 수요일 0.19, 목요일 0.21, 금요일 0.19, 토요일 0.21, 일요일 0.1입니다. 평일 0.3, 주말0.7현지인 이용 비중은 0.56입니다. 최근 12개월간 남성 회원 비중은 0.57, 여성 회원 비중은 0.43 입니다. 연령대별 회원 비중은 20대 이하 0.31, 30대 0.4, 40대 0.2, 50대 0.07, 60대 이상 0.02입니다. 이 가맹점의 이용 건수 구간은 3_25~50%이며, 이용 금액 구간은 1_상위 10% 이하입니다. 건당 평균 이용 금액 구간은 2_10~25%입니다. 해당 가맹점의 고객 평균 재방문율은 1.24 입니다. 해당 가맹점에 대한 이용객의 리뷰 키워드는 다음과 같습니다:  제주도 맛집 키워드:맛: 신선, 고소, 달달, 맛있다, 찌다, 칼칼, 매콤, 넘다, 굿굿, 최고, 기막히다, 극락, 별미, 핵존맛, 인생맛집, 문화충격, 맛도리, 짜다,  만족도: 만족, 행복, 감동, 추천, 꼭 가봐야 함, 재방문,  서비스: 친절, 직접, 설명, 챙겨주다, 배웅, 손수,  분위기:  음식량:  많다, 넉넉하다, 부족, 추가 주문,  ",33.4862367,126.4926515,1.24," 제주도 맛집 키워드:맛: 신선, 고소, 달달, 맛있다, 찌다, 칼칼, 매콤, 넘다, 굿굿, 최고, 기막히다, 극락, 별미, 핵존맛, 인생맛집, 문화충격, 맛도리, 짜다,  만족도: 만족, 행복, 감동, 추천, 꼭 가봐야 함, 재방문,  서비스: 친절, 직접, 설명, 챙겨주다, 배웅, 손수,  분위기:  음식량:  많다, 넉넉하다, 부족, 추가 주문,  "
202311,제주부리는횟집제주회센터,20230315,단품요리 전문,제주 제주시 용담삼동 1003-5번지 1호,상위 90% 초과(하위 10% 이하),상위 25~50%,상위 10% 이하,0.31,0.0,0.19,0.19,0.0,0.25,0.06,0.0,0.0,0.12,0.88,0.0,0.22,0.56,0.44,0.2,0.25,0.28,0.17,0.11,0.69,0.31,"202311 기준 '제주부리는횟집제주회센터'(주소: 제주 제주시 용담삼동 1003-5번지 1호)은/는 20230315에 개설된 단품요리 전문 업종입니다. 이용 시간대별 비중은 5~11시 0.0%, 12~13시 0.0%, 14~17시 0.12%, 18~22시 0.88%, 23~4시 0.0%입니다. 요일별 이용 비중은 월요일 0.31, 화요일 0.0, 수요일 0.19, 목요일 0.19, 금요일 0.0, 토요일 0.25, 일요일 0.06입니다. 평일 0.31, 주말0.69현지인 이용 비중은 0.22입니다. 최근 12개월간 남성 회원 비중은 0.56, 여성 회원 비중은 0.44 입니다. 연령대별 회원 비중은 20대 이하 0.2, 30대 0.25, 40대 0.28, 50대 0.17, 60대 이상 0.11입니다. 이 가맹점의 이용 건수 구간은 6_90% 초과(하위 10% 이하)이며, 이용 금액 구간은 3_25~50%입니다. 건당 평균 이용 금액 구간은 1_상위 10% 이하입니다. 해당 가맹점의 고객 평균 재방문율은 1.08 입니다. 해당 가맹점에 대한 이용객의 리뷰 키워드는 다음과 같습니다: [바다뷰, 신선, 맛있다, 깔끔, 친절, 푸짐, 가성비, 싱싱, 뷰, 맛집, 만족, 훌륭, 최고, 괜찮다, 좋다, 넉넉, 행복, 추천, 강추, 풍성] 
",33.5164755,126.505595,1.08,"[바다뷰, 신선, 맛있다, 깔끔, 친절, 푸짐, 가성비, 싱싱, 뷰, 맛집, 만족, 훌륭, 최고, 괜찮다, 좋다, 넉넉, 행복, 추천, 강추, 풍성] 
"
202311,이지고잉(EZGOING),20230821,단품요리 전문,제주 서귀포시 안덕면 덕수리 1476번지,상위 50~75%,상위 75~90%,상위 50~75%,0.09,0.29,0.11,0.0,0.27,0.13,0.11,0.49,0.36,0.16,0.0,0.0,0.52,0.35,0.65,0.22,0.23,0.39,0.13,0.03,0.76,0.24,"202311 기준 '이지고잉(EZGOING)'(주소: 제주 서귀포시 안덕면 덕수리 1476번지)은/는 20230821에 개설된 단품요리 전문 업종입니다. 이용 시간대별 비중은 5~11시 0.49%, 12~13시 0.36%, 14~17시 0.16%, 18~22시 0.0%, 23~4시 0.0%입니다. 요일별 이용 비중은 월요일 0.09, 화요일 0.29, 수요일 0.11, 목요일 0.0, 금요일 0.27, 토요일 0.13, 일요일 0.11입니다. 평일 0.24, 주말0.76현지인 이용 비중은 0.52입니다. 최근 12개월간 남성 회원 비중은 0.35, 여성 회원 비중은 0.65 입니다. 연령대별 회원 비중은 20대 이하 0.22, 30대 0.23, 40대 0.39, 50대 0.13, 60대 이상 0.03입니다. 이 가맹점의 이용 건수 구간은 4_50~75%이며, 이용 금액 구간은 5_75~90%입니다. 건당 평균 이용 금액 구간은 4_50~75%입니다. 해당 가맹점의 고객 평균 재방문율은 1.06 입니다. 해당 가맹점에 대한 이용객의 리뷰 키워드는 다음과 같습니다: [흑돼지, 김치필라프, 토순, 푸딩, 바질, 파스타, 화이트, 크림, 맛있다, 좋다, 예쁘다, 분위기, 넓다, 정원, 힐링, 깔끔하다, 친절하다, 뷰, 맛집, 넘다] 
",33.2790847,126.3144685,1.06,"[흑돼지, 김치필라프, 토순, 푸딩, 바질, 파스타, 화이트, 크림, 맛있다, 좋다, 예쁘다, 분위기, 넓다, 정원, 힐링, 깔끔하다, 친절하다, 뷰, 맛집, 넘다] 
"
202311,24시뼈다귀탕 신서귀점,20151217,단품요리 전문,제주 서귀포시 강정동 163-1번지,상위 10% 이하,상위 10% 이하,상위 50~75%,0.13,0.15,0.17,0.12,0.15,0.14,0.14,0.11,0.15,0.15,0.48,0.11,0.61,0.68,0.32,0.11,0.24,0.35,0.21,0.09,0.72,0.28,"202311 기준 '24시뼈다귀탕 신서귀점'(주소: 제주 서귀포시 강정동 163-1번지)은/는 20151217에 개설된 단품요리 전문 업종입니다. 이용 시간대별 비중은 5~11시 0.11%, 12~13시 0.15%, 14~17시 0.15%, 18~22시 0.48%, 23~4시 0.11%입니다. 요일별 이용 비중은 월요일 0.13, 화요일 0.15, 수요일 0.17, 목요일 0.12, 금요일 0.15, 토요일 0.14, 일요일 0.14입니다. 평일 0.28, 주말0.72현지인 이용 비중은 0.61입니다. 최근 12개월간 남성 회원 비중은 0.68, 여성 회원 비중은 0.32 입니다. 연령대별 회원 비중은 20대 이하 0.11, 30대 0.24, 40대 0.35, 50대 0.21, 60대 이상 0.09입니다. 이 가맹점의 이용 건수 구간은 1_상위 10% 이하이며, 이용 금액 구간은 1_상위 10% 이하입니다. 건당 평균 이용 금액 구간은 4_50~75%입니다. 해당 가맹점의 고객 평균 재방문율은 1.63 입니다. 해당 가맹점에 대한 이용객의 리뷰 키워드는 다음과 같습니다: [맛있다, 푸짐하다, 든든하다, 친절하다, 최고, 꿀맛, 굿굿, 맛집, 볶음밥, 수제비, 감자탕, 뼈, 국물, 콩나물, 미나리, 우거지, 칼칼, 시원하다, 양 많다, 넉넉하다] ",33.2535276,126.5075796,1.63,"[맛있다, 푸짐하다, 든든하다, 친절하다, 최고, 꿀맛, 굿굿, 맛집, 볶음밥, 수제비, 감자탕, 뼈, 국물, 콩나물, 미나리, 우거지, 칼칼, 시원하다, 양 많다, 넉넉하다] "
